{
  "needs": [
    { "need_id": "n1", "statement_md": "协议场景升版后需对既有变体重评（免训练）", "source": "assumptions" }
  ],
  "reuse_evidence": [],
  "targets": [
    {
      "target_key": "t1",
      "target_kind": "eval",
      "seq": 1,
      "critical": true,
      "budget_estimate": 0.5,
      "spec_md": "以升版协议 toy-gauss-cls@2 对既有 legal 变体 checkpoint 免训练重评",
      "need_ids": ["n1"],
      "eval_action": "create_evaluation",
      "attempt_purpose": "protocol_upgrade",
      "eval_key": "upgrade-v2-1",
      "evaluation_source": "protocol_upgrade"
    }
  ],
  "protocol": {
    "name": "toy-gauss-cls",
    "version": 2,
    "scope_spec": {
      "data": "二维双高斯混合，seed=42，n=2000",
      "split": "train 0.7 / heldout 0.3，分层；升版：heldout 加入 5% 标签噪声",
      "checkpoint_selection": "最终 epoch",
      "procedure": "对既有 checkpoint 重评全部声明指标"
    }
  },
  "metric_defs": [
    {
      "metric_id": "accuracy",
      "version": 1,
      "name": "留出集准确率",
      "direction": "higher",
      "compute_spec_md": "heldout 上 argmax 预测与标签一致的比例"
    }
  ],
  "readout_rules": [
    { "metric_id": "accuracy", "metric_ver": 1, "rule_md": "aggregate ≥ 0.88 判达标（噪声升版下限下调）" }
  ],
  "build_target_required_metric": [
    { "target_key": "t1", "metric_id": "accuracy", "metric_ver": 1 }
  ]
}
